" In a judgement delivered in the Secretary of Malankara Syrian Catholic College case14a (2007), the Supreme Court has summarized the general principles relating to establishment and administration of minority educational institutions in the following way :  The right of minorities to establish and administer educational institutions of their choice comprises the following rights : (i) To choose its governing body in whom the founders of the institution have faith and confidence to conduct and manage the affairs of the institution; (ii) To appoint teaching staff (teachers/lecturers and headmasters/ principals) as also non-teaching staff; and to take action if there is dereliction of duty on the part of any of its employees; (iii) To admit eligible students of their choice and to set up a reasonable fee structure; and (iv) To use its properties and assets for the benefit of the institution"
  The right conferred on minorities under Article 30 is only to ensure equality with the majority and not intended to place the minorities in a more advantageous position vis-à-vis the majority
 There is no reverse discrimination in favour of minorities
  The right to establish and administer educational institutions is not absolute
 Nor does it include the right to maladminister
 There can be regulatory measures for ensuring educational character and standards and maintaining academic excellence
" There can be checks on administration as are necessary to ensure that the administration is efficient and sound, so as to serve the academic needs of the institution"
" Regulations made by the State concerning generally the welfare of students and teachers, regulations laying down eligibility criteria and qualifications for appointment, as also conditions of service of employees (both teaching and non-teaching), regulations to prevent exploitation or oppression of employees, and regulations prescribing syllabus and curriculum of study fall under this category"
 Such regulations do not in any manner interfere with the right under Article 30(1)
"  Subject to the eligibility conditions/qualifications prescribed by the State being met, the unaided minority educational institutions will have the freedom to appoint teachers/lecturers by adopting any rational procedure of selection"
"  Extention of aid by the State, does not alter the nature and character of the minority educational institutions"
" The conditions can be imposed by the State to ensure proper utilization of the aid, without however diluting or abridging the right under Article 30(1)"
" RIGHT TO CONSTITUTIONAL REMEDIES A mere declaration of fundamental rights in the Constitution is meaningless, useless and worthless without providing an effective machinery for their enforcement, if and when they are violated"
" Hence, Article 32 confers the right to remedies for the enforcement of the fundamental rights of an aggrieved citizen"
" In other words, the right to get the Fundamental Rights protected is in itself a fundamental right"
 This makes the fundamental rights real
 That is why Dr Ambedkar called Article 32 as the most important article of the Constitution—‘an Article without which this constitution would be a nullity
 It is the very soul of the Constitution and the very heart of it’
 The Supreme Court has ruled that Article 32 is a basic feature of the Constitution
" Hence, it cannot be abridged or taken away even by way of an amendment to the Constitution"
 It contains the following four provisions: (a) The right to move the Supreme Court by appropriate proceedings for the enforcement of the Fundamental Rights is guaranteed
 (b) The Supreme Court shall have power to issue directions or orders or writs for the enforcement of any of the fundamental rights
" The writs issued may includehabeas corpus, mandamus, prohibition, certiorari and quowarranto"
" (c) Parliament can empower any other court to issue directions, orders and writs of all kinds"
" However, this can be done without prejudice to the above powers conferred on the Supreme Court"
 Any other court here does not include high courts because Article 226 has already conferred these powers on the high courts
 (d) The right to move the Supreme Court shall not be suspended except as otherwise provided for by the Constitution
 Thus the Constitution provides that the President can suspend the right to move any court for the enforcement of the fundamental rights during a national emergency (Article 359)
 It is thus clear that the Supreme Court has been constituted as the defender and guarantor of the fundamenetal rights of the citizens
 It has been vested with the ‘original’ and ‘wide’ powers for that purpose
" Original, because an aggrieved citizen can directly go to the Supreme Court, not necessarily by way of appeal"
" Wide, because its power is not restricted to issuing of orders or directions but also writs of all kinds"
" The purpose of Article 32 is to provide a guaranteed, effective, expedious, inexpensive and summary remedy for the protection of the fundamental rights"
" Only the Fundamental Rights guaranteed by the Constitution can be enforced under Article 32 and not any other right like non-fundamental constitutional rights, statutory rights, customary rights and so on"
" The violation of a fundamental right is the sine qua non for the exercise of the right conferred by Article 3 In other words, the Supreme Court, under Article 32, cannot determine a question that does not involve Fundamental Rights"
 Article 32 cannot be invoked simply to determine the constitutionality of an executive order or a legislation unless it directly infringes any of the fundamental rights
" In case of the enforcement of Fundamental Rights, the jurisdiction of the Supreme Court is original but not exclusive"
" It is concurrent with the jurisdiction of the high court under Article 22 It vests original powers in the high court to issue directions, orders and writs of all kinds for the enforcement of the Fundamental Rights"
" It means when the Fundamental Rights of a citizen are violated, the aggrieved party has the option of moving either the high court or the Supreme Court directly"
" Since the right guaranteed by Article 32 (ie, the right to move the Supreme Court where a fundamental right is infringed) is in itself a fundamental right, the availability of alternate remedy is no bar to relief under Article 3 However, the Supreme Court has ruled that where relief through high court is available under Article 226, the aggrieved party should first move the high court"
" WRITS—TYPES AND SCOPE The Supreme Court (under Article 32) and the high courts (under Article 226) can issue the writs of habeas corpus, mandamus, prohibition, certiorari and quo-warranto"
" Further, the Parliament (under Article 32) can empower any other court to issue these writs"
" Since no such provision has been made so far, only the Supreme Court and the high courts can issue the writs and not any other court"
" Before 1950, only the High Courts of Calcutta, Bombay and Madras had the power to issue the writs"
 Article 226 now empowers all the high courts to issue the writs
 These writs are borrowed from English law where they are known as ‘prerogative writs’
" They are so called in England as they were issued in the exercise of the prerogative of the King who was, and is still, described as the ‘fountain of justice’"
" Later, the high court started issuing these writs as extraordinary remedies to uphold the rights and liberties of the British people"
 The writ jurisdiction of the Supreme Court differs from that of a high court in three respects:  The Supreme Court can issue writs only for the enforcement of fundamental rights whereas a high court can issue writs not only for the enforcement of Fundamental Rights but also for any other purpose
 The expression ‘for any other purpose’ refers to the enforcement of an ordinary legal right
" Thus, the writ jurisdiction of the Supreme Court, in this respect, is narrower than that of high court"
  The Supreme Court can issue writs against a person or government throughout the territory of India whereas a high court can issue writs against a person residing or against a government or authority located within its territorial jurisdiction only or outside its territorial jurisdiction only if the cause of action arises within its territorial jurisdiction
"15 Thus, the territorial jurisdiction of the Supreme Court for the purpose of issuing writs is wider than that of a high court"
"  A remedy under Article 32 is in itself a Fundamental Right and hence, the Supreme Court may not refuse to exercise its writ jurisdiction"
" On the other hand, a remedy under Article 226 is discretionary and hence, a high court may refuse to exercise its writ jurisdiction"
 Article 32 does not merely confer power on the Supreme Court as Article 226 does on a high court to issue writs for the enforcement of fundamental rights or other rights as part of its general jurisdiction
 The Supreme Court is thus constituted as a defender and guarantor of the fundamental rights
" Now, we will proceed to understand the meaning and scope of different kinds of writs mentioned in Articles 32 and 226 of the Constitution: Habeas Corpus It is a Latin term which literally means ‘to have the body of’"
" It is an order issued by the court to a person who has detained another person, to produce the body of the latter before it"
 The court then examines the cause and legality of detention
" It would set the detained person free, if the detention is found to be illegal"
" Thus, this writ is a bulwark of individual liberty against arbitrary detention"
 The writ of habeas corpus can be issued against both public authorities as well as private individuals
" The writ, on the other hand, is not issued where the (a) detention is lawful, (b) the proceeding is for contempt of a legislature or a court, (c) detention is by a competent court, and (d) detention is outside the jurisdiction of the court"
 Mandamus It literally means ‘we command’
 It is a command issued by the court to a public official asking him to perform his official duties that he has failed or refused to perform
" It can also be issued against any public body, a corporation, an inferior court, a tribunal or government for the same purpose"
 The writ of mandamus cannot be issued (a) against a private individual or body; (b) to enforce departmental instruction that does not possess statutory force; (c) when the duty is discretionary and not mandatory; (d) to enforce a contractual obligation; (e) against the president of India or the state governors; and (f) against the chief justice of a high court acting in judicial capacity
" Prohibition Literally, it means ‘to forbid’"
 It is issued by a higher court to a lower court or tribunal to prevent the latter from exceeding its jurisdiction or usurping a jurisdiction that it does not possess
" Thus, unlike mandamus that directs activity, the prohibition directs inactivity"
 The writ of prohibition can be issued only against judicial and quasijudicial authorities
" It is not available against administrative authorities, legislative bodies, and private individuals or bodies"
" Certiorari In the literal sense, it means ‘to be certified’ or ‘to be informed’"
 It is issued by a higher court to a lower court or tribunal either to transfer a case pending with the latter to itself or to squash the order of the latter in a case
 It is issued on the grounds of excess of jurisdiction or lack of jurisdiction or error of law
" Thus, unlike prohibition, which is only preventive, certiorari is both preventive as well as curative"
" Previously, the writ of certiorari could be issued only against judicial and quasi-judicial authorities and not against administrative authories"
" However, in 1991, the Supreme Court ruled that the certiorari can be issued even against administrative authorities affecting rights of individuals"
" Like prohibition, certiorari is also not available against legislative bodies and private individuals or bodies"
" Quo-Warranto In the literal sense, it means ‘by what authority or warrant’"
 It is issued by the court to enquire into the legality of claim of a person to a public office
" Hence, it prevents illegal usurpation of public office by a person"
 The writ can be issued only in case of a substantive public office of a permanent character created by a statute or by the Constitution
 It cannot be issued in cases of ministerial office or private office
" Unlike the other four writs, this can be sought by any interested person and not necessarily by the aggrieved person"
" ARMED FORCES AND FUNDAMENTAL RIGHTS Article 33 empowers the Parliament to restrict or abrogate the fundamental rights of the members of armed forces, para-military forces, police forces, intelligence agencies and analogous forces"
 The objective of this provision is to ensure the proper discharge of their duties and the maintenance of discipline among them
 The power to make laws under Article 33 is conferred only on Parliament and not on state legislatures
 Any such law made by Parliament cannot be challenged in any court on the ground of contravention of any of the fundamental rights
" Accordingly, the Parliament has enacted the Army Act (1950), the Navy Act (1950), the Air Force Act (1950), the Police Forces (Restriction of Rights) Act, 1966, the Border Security Force Act and so on"
" These impose restrictions on their freedom of speech, right to form associations, right to be members of trade unions or political associations, right to communicate with the press, right to attend public meetings or demonstrations, etc"
" The expression‘members of the armed forces’ also covers such employees of the armed forces as barbers, carpenters, mechanics, cooks, chowkidars, bootmakers, tailors who are non-combatants"
" A parliamentary law enacted under Article 33 can also exclude the court martials (tribunals established under the military law) from the writ jurisdiction of the Supreme Court and the high courts, so far as the enforcement of Fundamental Rights is concerned"
 Table 3 Martial Law Vs National Emergency Martial Law National Emergency  It affects only Fundamental Rights
"  It affects not only Fundamental Rights but also Centre–state relations, distribution of revenues and legislative powers between centre and states and may extend the tenure of the Parliament"
 MARTIAL LAW AND FUNDAMENTAL RIGHTS Article 34 provides for the restrictions on fundamental rights while martial law is in force in any area within the territory of India
 It empowers the Parliament to indemnify any government servant or any other person for any act done by him in connection with the maintenance or restoration of order in any area where martial law was in force
" The Parliament can also validate any sentence passed, punishment inflicted, forfeiture ordered or other act done under martial law in such area"
 The Act of Indemnity made by the Parliament cannot be challenged in any court on the ground of contravention of any of the fundamental rights
 The concept of martial law has been borrowed in India from the English common law
" However, the expression ‘martial law’ has not been defined anywhere in the Constitution"
 It refers to a situation where civil administration is run by the military authorities according to their own rules and regulations framed outside the ordinary law
 It thus imply the suspension of ordinary law and the government by military tribunals
 It is different from the military law that is applicable to the armed forces
 There is also no specific or express provision in the Constitution that authorises the executive to declare martial law
" However, it is implicit in Article 34 under which martial law can be declared in any area within the territory of India"
" The martial law is imposed under the extraordinary circumstances like war, invasion, insurrection, rebellion, riot or any violent resistance to law"
 Its justification is to repel force by force for maintaining or restoring order in the society
" During the operation of martial law, the military authorities are vested with abnormal powers to take all necessary steps"
" They impose restrictions and regulations on the rights of the civilians, can punish the civilians and even condemn them to death"
 The Supreme Court held that the declaration of martial law does not ipso facto result in the suspension of the writ of habeas corpus
" The declaration of a martial law under Article 34 is different from the declaration of a national emergency under Article 35 The differences between the two are summarised in Table  EFFECTING CERTAIN FUNDAMENTAL RIGHTS Article 35 lays down that the power to make laws, to give effect to certain specified fundamental rights shall vest only in the Parliament and not in the state legislatures"
 This provision ensures that there is uniformity throughout India with regard to the nature of those fundamental rights and punishment for their infringement
" In this direction, Article 35 contains the following provisions:  The Parliament shall have (and the legislature of a state shall not have) power to make laws with respect to the following matters: (a) Prescribing residence as a condition for certain employments or appointments in a state or union territory or local authority or other authority (Article 16)"
" (b) Empowering courts other than the Supreme Court and the high courts to issue directions, orders and writs of all kinds for the enforcement of fundamental rights (Article 32)"
" (c) Restricting or abrogating the application of Fundamental Rights to members of armed forces, police forces, etc"
 (d) Indemnifying any government servant or any other person for any act done during the operation of martial law in any area (Article 34)
  Parliament shall have (and the legislature of a state shall not have) powers to make laws for prescribing punishment for those acts that are declared to be offences under the fundamental rights
 These include the following: (a) Untouchability (Article 17)
 (b) Traffic in human beings and forced labour (Article 23)
" Further, the Parliament shall, after the commencement of the Constitution, make laws for prescribing punishment for the above acts, thus making it obligatory on the part of the Parliament to enact such laws"
  Any law in force at the commencement of the Constitution with respect to any of the matters specified above is to continue in force until altered or repealed or amended by the Parliament
" It should be noted that Article 35 extends the competence of the Parliament to make a law on the matters specified above, even though some of those matters may fall within the sphere of the state legislatures ( State List)"
" PRESENT POSITION OF RIGHT TO PROPERTY Originally, the right to property was one of the seven fundamental rights under Part III of the Constitution"
" It was dealt by Article 19(1)(f) and Article 3 Article 19(1)(f) guaranteed to every citizen the right to acquire, hold and dispose of property"
" Article 31, on the other hand, guaranteed to every person, whether citizen or non-citizen, right against deprivation of his property"
 It provided that no person shall be deprived of his property except by authority of law
" It empowered the State to acquire or requisition the property of a person on two conditions: (a) it should be for public purpose, and (b) it should provide for payment of compensation (amount) to the owner"
" Since the commencement of the Constitution, the Fundamental Right to Property has been the most controversial"
 Most of the litigation centred around the obligation of the state to pay compensation for acquisition or requisition of private property
" Therefore, the 44th Amendment Act of 1978 abolished the right to property as a Fundamental Right by repealing Article 19(1)(f) and Article 31 from Part III"
" Instead, the Act inserted a new Article 300A in Part XII under the heading ‘Right to Property’"
 It provides that no person shall be deprived of his property except by authority of law
" Thus, the right to property still remains a legal right or a constitutional right, though no longer a fundamental right"
 It is not a part of the basic structure of the Constitution
" The right to property as a legal right (as distinct from the Fundamental Rights) has the following implications: (a) It can be regulated ie, curtailed, abridged or modified without constitutional amend-ment by an ordinary law of the Parliament"
 (b) It protects private property against executive action but not against legislative action
" (c) In case of violation, the aggrieved person cannot directly move the Supreme Court under Article 32 (right to constitutional remedies including writs) for its enforcement"
 He can move the High Court under Article 22 (d) No guaranteed right to compensation in case of acquisition or requisition of the private property by the state
" Though the Fundamental Right to Property under Part III has been abolished, the Part III still carries two provisions which provide for the guaranteed right to compensation in case of acquisition or requisition of the private property by the state"
 These two cases where compensation has to be paid are: (a) When the State acquires the property of a minority educational institution (Article 30); and (b) When the State acquires the land held by a person under his personal cultivation and the land is within the statutory ceiling limits (Article 31 A)
" The first provision was added by the 44th Amendment Act (1978), while the second provision was added by the 17th Amendment Act (1964)"
" Further, Articles 31A, 31B and 31C have been retained as exceptions to the fundamental rights"
" EXCEPTIONS TO FUNDAMENTAL RIGHTS  Saving of Laws Providing for Acquisition of Estates, etc"
" Article 31A16 saves five categories of laws from being challenged and invalidated on the ground of contravention of the fundamental rights conferred by Article 14 (equality before law and equal protection of laws) and Article 19 (protection of six rights in respect of speech, assembly, movement, etc"
" They are related to agricultural land reforms, industry and commerce and include the following: (a) Acquisition of estates17 and related rights by the State; (b) Taking over the management of properties by the State; (c) Amalgamation of corporations; (d) Extinguishment or modification of rights of directors or shareholders of corporations; and (e) Extinguishment or modification of mining leases"
 Article 31A does not immunise a state law from judicial review unless it has been reserved for the president’s consideration and has received his assent
 This Article also provides for the payment of compensation at market value when the state acquires the land held by a person under his personal cultivation and the land is within the statutory ceiling limit
 Article 31B immunises any law included in the Ninth Schedule from all the fundamental rights whether or not the law falls under any of the five categories specified in Article 31A
" Coelho case18a (2007), the Supreme Court ruled that there could not be any blanket immunity from judicial review of laws included in the Ninth Schedule"
 The court held that judicial review is a ‘basic feature’ of the constitution and it could not be taken away by putting a law under the Ninth Schedule
" It said that the laws placed under the Ninth Schedule after April 24, 1973, are open to challenge in court if they violated fundamentals rights guaranteed under Articles 14, 15, 19 and 21 or the ‘basic structure’ of the constitution"
" It was on April 24, 1973, that the Supreme Court first propounded the doctrine of ‘basic structure’ or ‘basic features’ of the constitution in its landmark verdict in the Kesavananda Bharati Case"
"19 Originally (in 1951), the Ninth Schedule contained only 13 acts and regulations but at present (in 2016) their number is 2820 Of these, the acts and regulations of the state legislature deal with land reforms and abolition of the zamindari system and that of the Parliament deal with other matters"
"  Saving of Laws Giving Effect to Certain Directive Principles Article 31C, as inserted by the 25th Amendment Act of 1971, contained the following two provisions: (a) No law that seeks to implement the socialistic directive principles specified in Article 39(b)21 or (c)22 shall be void on the ground of contravention of the fundamental rights conferred by Article 14 (equality before law and equal protection of laws) or Article 19 (protection of six rights in respect of speech, assembly, movement, etc"
) (b) No law containing a declaration that it is for giving effect to such policy shall be questioned in any court on the ground that it does not give effect to such a policy
" In the Kesavananda Bharati case23 (1973), the Supreme Court declared the above second provision of Article 31C as unconstitutional and invalid on the ground that judicial review is a basic feature of the Constitution and hence, cannot be taken away"
 The 42nd Amendment Act (1976) extended the scope of the above first provision of Article 31C by including within its protection any law to implement any of the directive principles specified in Part IV of the Constitution and not merely in Article 39 (b) or (c)
 CRITICISM OF FUNDAMENTAL RIGHTS The Fundamental Rights enshrined in Part III of the Constitution have met with a wide and varied criticism
" The arguments of the critics are:  Excessive Limitations They are subjected to innumerable exceptions, restrictions, qualifications and explanations"
