" Hence, the critics remarked that the Constitution grants Fundamental Rights with one hand and takes them away with the other"
 Jaspat Roy Kapoor went to the extent of saying that the chapter dealing with the fundamental rights should be renamed as ‘Limitaions on Fundamental Rights’ or ‘Fundamental Rights and Limitations Thereon’
  No Social and Economic Rights The list is not comprehensive as it mainly consists of political rights
" It makes no provision for important social and economic rights like right to social security, right to work, right to employment, right to rest and leisure and so on"
 These rights are made available to the citizens of advanced democratic countries
" Also, the socialistic constitutions of erstwhile USSR or China provided for such rights"
  Preventive Detention The critics assert that the provision for preventive detention (Article 22) takes away the spirit and substance of the chapter on fundamental rights
 It confers arbitrary powers on the State and negates individual liberty
 It justifies the criticism that the Constitution of India deals more with the rights of the State against the individual than with the rights of the individual against the State
" Notably, no democratic country in the world has made preventive detention as an integral part of their Constitutions as has been made in India"
"  No Consistent Philosophy According to some critics, the chapter on fundamental rights is not the product of any philosophical principle"
 Sir Ivor Jennings expressed this view when he said that the Fundamental Rights proclaimed by the Indian Constitution are based on no consistent philosophy
25 The critics say that this creates difficulty for the Supreme Court and the high courts in interpreting the fundamental rights
" RIGHTS OUTSIDE PART III Besides the Fundamental Rights included in Part III, there are certain other rights contained in other parts of the Constitution"
 These rights are known as constitutional rights or legal rights or non-fundamental rights
 They are:  No tax shall be levied or collected except by authority of law (Article 265 in Part XII)
  No person shall be deprived of his property save by authority of law (Article 300-A in Part XII)
"  Trade, commerce and intercourse throughout the territory of India shall be free (Article 301 in Part XIII)"
  The elections to the Lok Sabha and the State Legislative Assembly shall be on the basis of adult suffrage (Article 326 in Part XV)
" Even though the above rights are also equally justiciable, they are different from the Fundamental Rights"
" In case of violation of a Fundamental Right, the aggrieved person can directly move the Supreme Court for its enforcement under Article 32, which is in itself a fundamental right"
" But, in case of violation of the above rights, the aggrieved person cannot avail this constitutional remedy"
 He can move the High Court by an ordinary suit or under Article 226 (writ jurisdiction of high court)
 Table 4 Articles Related to Fundamental Rights at a Glance Article No
" Subject Matter General 1 Definition of State 1 Laws inconsistent with or in derogation of the Fundamental Rights Right to Equality 1 Equality before law 1 Prohibition of discrimination on grounds of religion, race, caste, sex or place of birth 1 Equality of opportunity in matters of public employment 1 Abolition of untouchability 1 Abolition of titles Right to Freedom 1 Protection of certain rights regarding freedom of speech, etc"
 Protection in respect of conviction for offences 2 Protection of life and personal liberty 21A
 Right to education 2 Protection against arrest and detention in certain cases Article No
" Subject Matter Right against Exploitation 2 Prohibition of traffic in human beings and forced labour 2 Prohibition of employment of children in factories, etc"
" Right to Freedom of Religion 2 Freedom of conscience and free profession, practice and propagation of religion 2 Freedom to manage religious affairs 2 Freedom as to payment of taxes for promotion of any particular religion 2 Freedom as to attendance at religious instruction or religious worship in certain educational institutions"
 Cultural and Educational Rights 2 Protection of interests of minorities 30
 Right of minorities to establish and administer educational institutions 3 Compulsory acquisition of property—(Repealed) Saving of Certain Laws 31A
" Saving of laws providing for acquisition of estates, etc"
 Validation of certain Acts and Regulations 31C
 Saving of laws giving effect to certain directive principles 31D
 Saving of laws in respect of anti-national activities—(Repealed) Right to Constitutional Remedies 3 Remedies for enforcement of rights conferred by this part 32A
" Constitutional validity of State laws not to be considered in proceedings under Article 32—(Repealed) 3 Power of Parliament to modify the rights conferred by this part in their application to forces, etc"
 3 Restriction on rights conferred by this part while martial law is in force in any area 3 Legislation to give effect to the provisions of this part 
"HBO Max secures exclusive USA streaming rights for Dr. Who, other BBC series"
Homeland Security's Civil Rights Unit Lacks Power To Protect Migrant Kids
"The Biggest, Most Disruptive Strike for Abortion Rights Is Coming to the US"
Awake NY & Chroma Release T-Shirt to Support Migrant Rights
Egypt must end human rights abuses of political prisoners: group
The Universal Declaration of Human Rights hits the streets
Rights activists criticize Uganda for academic's conviction
Oscilloscope Acquires U.S. Rights To ‘The Twentieth Century’
Rights body raises a stink over Assam NRC data release
U.S. calls on China to release human rights activist
Saudi Arabia Chips Away at Oppressive System by Granting Women Travel Rights
Google Chrome Ad Blocking Plans Slammed By Digital Rights Group
"Sen. Dianne Feinstein introduces a bill that would give voters five rights, including the right to be notified when campaigns obtain their data (Rae Hodge/CNET)"
"The Double-A Team: guns, dogs and simpler times in Dead to Rights"
‘Nancy Drew’: CBS All Access Lands Streaming Rights To New CW Series
"Pro rata rights, immigration, the sharing economy, AWS, Ray Dalio, and China’s smartphones"
Homeland Security's Civil Rights Unit Lacks Power To Protect Migrant Kids
"The Biggest, Most Disruptive Strike for Abortion Rights Is Coming to the US"
The Universal Declaration of Human Rights hits the streets
Carving Up Film Rights
Rights activists criticize Uganda for academic's conviction
Rights body raises a stink over Assam NRC data release
Saudi Arabia Chips Away at Oppressive System by Granting Women Travel Rights
"Sen. Dianne Feinstein introduces a bill that would give voters five rights, including the right to be notified when campaigns obtain their data (Rae Hodge/CNET)"
"The Double-A Team: guns, dogs and simpler times in Dead to Rights"
Manipur: Child Rights Commission chairperson named co-accused in sexual assault case
Homeland Security Civil Rights Unit Powerless in Helping Migrant Kids
Super Break and Late Rooms collapse hours after urging customers to book – what are your rights?
"Pro rata rights, immigration, the sharing economy, AWS, Ray Dalio, and China’s smartphones"
CW Seed picks up streaming rights to Schitt's Creek
"Argentine judge suspends delivery apps, protect workers' rights"
Man allowed conjugal rights with wife living separately since 2011
The CW Secures Full In-Season Streaming Rights To New Series – TCA
‘Schitt’s Creek’: CW Seed Acquires Off-Season Streaming Rights To Pop TV Comedy – TCA
Premier League ‘Big Six’ cash in as overseas TV rights rise 35 per cent
Semenya’s human rights should come before science
Child rights workers welcome POCSO Amendment Bill
The End of Thailand’s Human Rights Commission?
"U.S. closely following events in Kashmir, expresses rights concerns: spokeswoman"
CW Seed picks up streaming rights to Schitt's Creek
In One Chart: These lawmakers receive the most campaign money from gun-rights backers like the NRA
Slitherine acquires Master of Magic publishing rights from Atari
"Argentine judge suspends delivery apps, protect workers' rights"
Man allowed conjugal rights with wife living separately since 2011
"Amid Conservative Assault on Organized Labor, Democratic Lawmakers Are Advancing Laws to Expand Workers’ Rights"
The CW Secures Full In-Season Streaming Rights To New Series – TCA
Best of Monday at NFL training camps: Breaking bikes and naming rights
‘Schitt’s Creek’: CW Seed Acquires Off-Season Streaming Rights To Pop TV Comedy – TCA
Heathrow and BA strikes: what are your rights?
Saudi Arabia women's rights reforms may still be thwarted by custom
"Polish state firms pouring ad cash into media that attack gay rights, research data shows"
DEEP DIVE: CBP’s Social Media Surveillance Poses Risks to Free Speech and Privacy Rights
UN study releases a report on how businesses run by Myanmar’s army are engaged in human rights violations
"Women of the Civil Rights Movement Anthology Series In Works At ABC From Jay-Z, Will Smith & Kapital"
Child rights workers welcome POCSO Amendment Bill
"U.S. closely following events in Kashmir, expresses rights concerns: spokeswoman"
Twitch gets exclusive livestreaming rights to USA Basketball
In One Chart: These lawmakers receive the most campaign money from gun-rights backers like the NRA
Slitherine acquires Master of Magic publishing rights from Atari
"Sex worker rights: Hysteria, surveillance and threats to fundamental freedoms"
Utilities Clash With Tech Giants in Fight Over Wireless Rights
Syndicado Nabs World Rights to Locarno’s ‘Ivana the Terrible’ (EXCLUSIVE)
Fig to pay lump sum to Wasteland 3 investors as Microsoft buys publishing rights
‘HIV-positive children staying in care homes struggle for property rights’
Transgender Rights Bill
"Amid Conservative Assault on Organized Labor, Democratic Lawmakers Are Advancing Laws to Expand Workers’ Rights"
Best of Monday at NFL training camps: Breaking bikes and naming rights
The Administration Should Be Bold In Condemning Human Rights Abuses In China
"If You Live in Saudi Arabia, How Will the New Travel and Work Rights Affect You?"
Heathrow and BA strikes: what are your rights?
Saudi Arabia women's rights reforms may still be thwarted by custom
"Polish state firms pouring ad cash into media that attack gay rights, research data shows"
Twitch gets exclusive livestreaming rights to USA Basketball
Five new rights you now get as a consumer
"Sex worker rights: Hysteria, surveillance and threats to fundamental freedoms"
Utilities Clash With Tech Giants in Fight Over Wireless Rights
Syndicado Nabs World Rights to Locarno’s ‘Ivana the Terrible’ (EXCLUSIVE)
Fig to pay lump sum to Wasteland 3 investors as Microsoft buys publishing rights
‘HIV-positive children staying in care homes struggle for property rights’
What Indigenous Rights Have to Do With Fighting Climate Change
Black Hat 2019: Ethical Hackers Must Protect Digital Human Rights
Transgender Rights Bill
More legislation on digital rights in Lok Sabha than Rajya Sabha: report
The Administration Should Be Bold In Condemning Human Rights Abuses In China
"If You Live in Saudi Arabia, How Will the New Travel and Work Rights Affect You?"
Taylor Swift Says She Spoke Out For LGBTQ Rights After Her Best Friend Thought She Might Be Homophobic
How women shaped the Civil Rights Movement through music
Five new rights you now get as a consumer
Taylor Swift Shares How Todrick Hall Prompted Her LGBTQ Rights Activism
What Indigenous Rights Have to Do With Fighting Climate Change
Black Hat 2019: Ethical Hackers Must Protect Digital Human Rights
U.S. sanctions on Venezuela may worsen crisis: U.N. rights chief
UAE releases activists on Eid amnesty: rights groups
"Fighting in northeastern Colombia puts 300,000 civilians in danger: rights group"
Tomi Lahren claims gun rights are gay rights. Huh?
More legislation on digital rights in Lok Sabha than Rajya Sabha: report
Rights group warns of new 'war' in Colombia's border zone with Venezuela
The Rush to Restrict Gun Rights
"US sanctions may worsen Venezuela suffering, says UN rights chief"
Taylor Swift explained why she used LGBTQ rights as a theme in her video that was accused of 'queerbaiting'
"El Paso and Dayton make you want to act, but 'red flag' laws violate rights to due process"
Mass shootings could prompt Supreme Court to sidestep cases seeking to expand Second Amendment rights
Taylor Swift Says She Spoke Out For LGBTQ Rights After Her Best Friend Thought She Might Be Homophobic
What woman must know about inheritance rights
How women shaped the Civil Rights Movement through music
"Trump news – live: President defends gun rights and ICE raids, amid controversy over thumbs-up photo with El Paso baby"
Taylor Swift Shares How Todrick Hall Prompted Her LGBTQ Rights Activism
U.S. sanctions on Venezuela may worsen crisis: U.N. rights chief
Bangladesh must investigate rife torture: U.N. rights body
UAE releases activists on Eid amnesty: rights groups
"Fighting in northeastern Colombia puts 300,000 civilians in danger: rights group"
"Coke Ad Riles Hungary Conservatives, Part of Larger Gay Rights Battle"
Tomi Lahren claims gun rights are gay rights. Huh?
Missouri Walmart panic caused by armed man testing gun rights
"US sanctions may worsen Venezuela suffering, says UN rights chief"
Taylor Swift explained why she used LGBTQ rights as a theme in her video that was accused of 'queerbaiting'
"El Paso and Dayton make you want to act, but 'red flag' laws violate rights to due process"
Mass shootings could prompt Supreme Court to sidestep cases seeking to expand Second Amendment rights
What woman must know about inheritance rights
"Trump news – live: President defends gun rights and ICE raids, amid controversy over thumbs-up photo with El Paso baby"
How to Know if a User has Sudo Rights
Bangladesh must investigate rife torture: U.N. rights body
"Coke Ad Riles Hungary Conservatives, Part of Larger Gay Rights Battle"
Civil rights probe opened into transgender athlete policy
Anthony Joshua fight with Andy Ruiz confirmed - but Saudi Arabia venue raises human rights concerns
Civil Rights Probe Opened Into Transgender Athlete Policy
"Armed man who sowed panic at Walmart claimed he was testing his Second Amendment rights, police say - The Washington Post"
Tribals in city unite to demand rights
Missouri Walmart panic caused by armed man testing gun rights
Calls for Michigan civil rights director to step down grow
How to Know if a User has Sudo Rights
Explained: What the transgenders’ rights Bill passed by Lok Sabha says
"In New Zealand, young M?ori women lead the battle for indigenous rights"
Immortal Hulk: Bruce Banner's Alter Ego Supports Transgender Rights
"Armed man who sowed panic at Walmart claimed he was testing his Second Amendment rights, police say - The Washington Post"
"‘Mixing religion, politics sees rights violation worldwide’"
Latino civil rights organization holds march in El Paso
Colorado lawmaker wins recall fight against gun rights groups
Are gun rights supporters misinterpreting the Second Amendment?
HOW’S ABOUT NO: Want Gun Rights? Become an Indentured Servant….
BBC secures exclusive Women's Euro 2021 rights
"Immigrants have rights when ICE comes to arrest them, but experts warn this only goes so far"
The U.N. Human Rights Council Has Narrowly Agreed to Probe Killings in the Philippines
The Long History of the U.S. Government Asking Americans Whether They Are Citizens
Conservatives Are Making Abortion Rights More Popular By Attacking Them
Seed rights: Ministry notice to PepsiCo
Security camera shows Detroit cop causing serious road accident then detaining his victim
"Divided Over Abortion, but Joining Forces for Women’s Workplace Rights"
Microsoft's reseller partners are upset with its decision to stop giving them internal use rights for products; source says it costs Microsoft ~$200M per year (Mary Jo Foley/ZDNet)
Serena Williams: The Day I Stop Fighting for Equality Is the Day I'm in My Grave
"Microsoft responds to partner feedback, brings back internal use rights benefit"
Meet The Afghan Women Fighting to Protect Their Rights
Trump’s Ominous Attempt to Redefine Human Rights
Know Your Rights: How Immigrant Rights Activists Are Preparing for Looming ICE Deportation Raids
UN rights council to investigate killings in Philippine drug war
"Nationwide wave of immigrant arrests to commence this weekend, Trump says"
22 countries signed an 'unprecedented' letter condemning China's oppression of Muslims. But none of them come from the Islamic world.
Abortion-pill obstacles: How doctors' reluctance and long-distance travel stop many Canadians from getting Mifegymiso - The Globe and Mail
National Commission for Protection of Child Rights (NCPCR)
Atticus Finch: Civil-Rights Hero or Stereotypical Racist?
Growing up without a permanent home can negatively affect children's health
Zebrafish could teach humans a lot about the science of sleep
Army to Test New Helluva Way to Die: Robotic Combat Vehicles
Trump Says ICE Raids Targeting Migrants Will Take Place Sunday
What States Do To Protect Undocumented Immigrants’ Drivers License Info
"Centre to regularise 1,797 colonies in Delhi by August end"
Major US cities brace for ICE raids; Officials assure residents of their rights
Harris double downs on debate confrontation as Biden maintains support from black voters
‘We’re Almost Extinct’: China’s Investigative Journalists Are Silenced Under Xi
What Ugandans can teach each of us about justice
Meet The Afghan Women Fighting to Protect Their Rights
Mayor Bill de Blasio Says ICE Raids Have Begun in New York City
Armed man fatally shot by police outside ICE facility
The Workers in Our Homes Deserve Rights
"If the Supreme Court Won’t Prevent Gerrymandering, Who Will?"
Officials in Multiple Cities Speak Out Against Planned ICE Raids and in Support of Their Immigrant Communities
'Space Invaders' movie is closer to becoming a reality
"Immigrants in hiding, but no sign of threatened mass U.S. raids"
Churches Across the U.S. Show Support for Immigrant Communities as ICE Raids Begin
Human Rights and Foreign Policy
"Amid Acosta's resignation, prosecutors are questioning the 'sweetheart deal' he gave to Jeffrey Epstein"
The Amazon Prime Day strike could be a turning point for workers' rights
"On Prime Day, Amazon workers and immigrant rights organizations are protesting"
Transportation Minister Marc Garneau 'Disappointed' With Airlines' Legal Action Against Passenger Rights - HuffPost Canada
Updated air passenger rights protections come into effect Monday - CTV News
Garneau 'disappointed' in airlines' move against new passenger bill of rights - CP24 Toronto's Breaking News
Malta’s Fledgling Movement for Abortion Rights
"Saudi Arabia, Russia and North Korea were among 37 countries that signed a letter praising China's 'remarkable achievements in the field of human rights' over its Uighur Muslim oppression"
"Amid ICE raids, '#KnowYourRights' efforts share vital information"
Major US cities brace for ICE raids; Officials assure residents of their rights
"In light of federal immigration raids, Salinas residents learn their rights, resources"
Rights groups vow to challenge Trump's new asylum rule
Streamline Global Nabs Rights To ‘Crescendo’ Novel
The Workers in Our Homes Deserve Rights
Louisiana Civil Rights Activist Is Found Murdered in Trunk of Her Car
Vluchtelingenwerk Vlaanderen: Turning extreme right into human rights
New rules lay out what rights Canadian airline passengers have: here's the list
Human rights organisations call for investigation into Estemirova murder on 10-year anniversary
Human Rights and Foreign Policy
The Amazon Prime Day strike could be a turning point for workers' rights
"On Prime Day, Amazon workers and immigrant rights organizations are protesting"
Transportation Minister Marc Garneau 'Disappointed' With Airlines' Legal Action Against Passenger Rights - HuffPost Canada
Updated air passenger rights protections come into effect Monday - CTV News
Garneau 'disappointed' in airlines' move against new passenger bill of rights - CP24 Toronto's Breaking News
Malta’s Fledgling Movement for Abortion Rights
"Saudi Arabia, Russia and North Korea were among 37 countries that signed a letter praising China's 'remarkable achievements in the field of human rights' over its Uighur Muslim oppression"
"Saudi Arabia, Russia and North Korea were among 37 countries that signed a letter praising China's 'remarkable achievements in the field of human rights' over its Uighur Muslim oppression"
"Amid ICE raids, '#KnowYourRights' efforts share vital information"
"In light of federal immigration raids, Salinas residents learn their rights, resources"
"Pivotal, part of the Dell empire, is making a big bet on the Google-created Kubernetes cloud software as it rights the course after a 'train wreck quarter' (PVTL)"
Harris wins endorsement of civil rights attorney Benjamin Crump
"Civilians pay human cost of Yemen's war, rights group says"
Rights groups vow to challenge Trump's new asylum rule
Streamline Global Nabs Rights To ‘Crescendo’ Novel
"Transgender Persons (Protection of Rights) Bill, 2016"
I regret to inform you that Trump’s lawyers are right about a crucial civil rights case
U.K.'s Hammond Presses Saudis to Deal With Sports Rights Theft
Civil rights activist murdered
"Pivotal, part of the Dell empire, is making a big bet on the Google-created Kubernetes cloud software as it rights the course after a 'train wreck quarter' (PVTL)"
Is it a good idea for Apple to buy exclusive rights to podcasts?
Harris wins endorsement of civil rights attorney Benjamin Crump
"Civilians pay human cost of Yemen's war, rights group says"
Influencer Partnerships: How to Navigate Influencer Usage Rights and Repurpose Content
"Transgender Persons (Protection of Rights) Bill, 2016"
Do Children have Unique Human Rights?
I regret to inform you that Trump’s lawyers are right about a crucial civil rights case
U.K.'s Hammond Presses Saudis to Deal With Sports Rights Theft
Apple Could Buy Exclusive Rights To Original Podcasts
Academic Minute: Human Rights
Here's why Apple is seeking exclusive podcast rights (AAPL)
"When you use FaceApp, you give a Russian company ""perpetual, irrevocable"" rights to your photos"
An Unintended Consequence of Trump’s Repeated Threats of Raids: More Immigrants Know Their Rights
Thousands of elderly Hong Kongers march in solidarity with young human rights activists
Is it a good idea for Apple to buy exclusive rights to podcasts?
'Illegal colony residents to get ownership rights'
Rushlake Takes World Rights for Two Acclaimed African Docs (EXCLUSIVE)
Influencer Partnerships: How to Navigate Influencer Usage Rights and Repurpose Content
Do Children have Unique Human Rights?
Apple Could Buy Exclusive Rights To Original Podcasts
FaceApp Could Be Keeping The Rights To Your Photos
Tenant Who Was Behind on Rent Allegedly Killed La. Civil Rights Leader
Here's why Apple is seeking exclusive podcast rights (AAPL)
'Hostages against a no-deal Brexit': British MPs demand the EU protects citizen rights
"When you use FaceApp, you give a Russian company ""perpetual, irrevocable"" rights to your photos"
An Unintended Consequence of Trump’s Repeated Threats of Raids: More Immigrants Know Their Rights
Thousands of elderly Hong Kongers march in solidarity with young human rights activists
Uber drivers demand their labor rights - CNET
'Illegal colony residents to get ownership rights'
Rushlake Takes World Rights for Two Acclaimed African Docs (EXCLUSIVE)
Protection of Women and Child Rights
Nations with strong women's rights likely to have better population health and faster growth
Lok Sabha passes Bill to amend human rights law
FaceApp Could Be Keeping The Rights To Your Photos
"‘Children should not be detained:’ Homestead center violating rights, Amnesty says - Bradenton Herald"
"Lok Sabha passes NHRC amendment bill, govt assures protection of human rights"
"Parliament LIVE: Protection of Human Rights, Transgender Persons bill to be introduced in Lok Sabha"
Europe's human rights court rules against owners of Georgian pro-opposition TV channel in ownership row
U.S. imposes sanctions on four Iraqis over human rights and corruption
'Hostages against a no-deal Brexit': British MPs demand the EU protects citizen rights
Uber drivers demand their labor rights - CNET
Transgender Rights Bill introduced in Lok Sabha
Protection of Women and Child Rights
Nations with strong women's rights likely to have better population health and faster growth
Lok Sabha passes Bill to amend human rights law
U.S. should reject 'prejudice' on China religious rights: state media
"‘Children should not be detained:’ Homestead center violating rights, Amnesty says - Bradenton Herald"
"Lok Sabha passes NHRC amendment bill, govt assures protection of human rights"
"Parliament LIVE: Protection of Human Rights, Transgender Persons bill to be introduced in Lok Sabha"
"Protection of Human Rights (Amendments) Bill, 2019"
Kyoto Arson Attack Demonstrates A Key Point In The Gun Rights Argument - AmmoLand Shooting Sports News
A Pro-Israel Democrat Withdrew Her Support for a Bill Supporting Palestinian Rights. She Now Claims Her Name Was Added by Accident.
Transgender Rights Bill introduced in Lok Sabha
U.S. should reject 'prejudice' on China religious rights: state media
