"The Fundamental Rights are enshrined in Part III of the Constitution from Articles 12 to 3 In this regard, the framers of the Constitution derived inspiration from the Constitution of USA ( Bill of Rights)"
 Part III of the Constitution is rightly described as the Magna Carta of India
 It contains a very long and comprehensive list of ‘justiciable’ Fundamental Rights
" In fact, the Fundamental Rights in our Constitution are more elaborate than those found in the Constitution of any other country in the world, including the USA"
 The Fundamental Rights are guaranteed by the Constitution to all persons without any discrimination
" They uphold the equality of all individuals, the dignity of the individual, the larger public interest and unity of the nation"
 The Fundamental Rights are meant for promoting the ideal of political democracy
" They prevent the establishment of an authoritarian and despotic rule in the country, and protect the liberties and freedoms of the people against the invasion by the State"
 They operate as limitations on the tyranny of the executive and arbitrary laws of the legislature
" In short, they aim at establishing ‘a government of laws and not of men’"
" The Fundamental Rights are named so because they are guaranteed and protected by the Constitution, which is the fundamental law of the land"
" They are ‘fundamental’ also in the sense that they are most essential for the allround development (material, intellectual, moral and spiritual) of the individuals"
" Originally, the Constitution provided for seven Fundamental Rights viz,  Right to equality (Articles 14–18)  Right to freedom (Articles 19–22)  Right against exploitation (Articles 23–24)  Right to freedom of religion (Articles 25–28)  Cultural and educational rights (Articles 29–30)  Right to property (Article 31)  Right to constitutional remedies (Article 32) However, the right to property was deleted from the list of Fundamental Rights by the 44th Amendment Act, 197 It is made a legal right under Article 300-A in Part XII of the Constitution"
" So at present, there are only six Fundamental Rights"
" FEATURES OF FUNDAMENTAL RIGHTS The Fundamental Rights guaranteed by the Constitution are characterised by the following:  Some of them are available only to the citizens while others are available to all persons whether citizens, foreigners or legal persons like corporations or companies"
" Thus, they strike a balance between the rights of the individual and those of the society as a whole, between individual liberty and social control"
"  Most of them are available against the arbitrary action of the State, with a few exceptions like those against the State’s action and against the action of private individuals"
" When the rights that are available against the State’s action only are violated by the private individuals, there are no constitutional remedies but only ordinary legal remedies"
"  They are justiciable, allowing persons to move the courts for their enforcement, if and when they are violated"
  They are defended and guaranteed by the Supreme Court
" Hence, the aggrieved person can directly go to the Supreme Court, not necessarily by way of appeal against the judgement of the high courts"
 The Parliament can curtail or repeal them but only by a constitutional amendment act and not by an ordinary act
" Moreover, this can be done without affecting the ‘basic structure’ of the Constitution"
"  They can be suspended during the operation of a National Emergency except the rights guaranteed by Articles 20 and 2 Further, the six rights guaranteed by Article 19 can be suspended only when emergency is declared on the grounds of war or external aggression ( external emergency) and not on the ground of armed rebellion ( internal emergency)"
 (The suspension of fundamental rights during a national Emergency is explained in detail in Chapter 16)
"  Their scope of operation is limited by Article 31A (saving of laws providing for acquisition of estates, etc"
Article 31B (validation of certain acts and regulations included in the 9th Schedule) and Article 31C (saving of laws giving effect to certain directive principles)
"  Their application to the members of armed forces, para-military forces, police forces, intelligence agencies and analogous services can be restricted or abrogated by the Parliament (Article 33)"
 Their application can be restricted while martial law is in force in any area
 Martial law means ‘military rule’ imposed under abnormal circumstances to restore order (Article 34)
 It is different from the imposition of national emergency
 Most of them are directly enforceable (self-executory) while a few of them can be enforced on the basis of a law made for giving effect to them
 Such a law can be made only by the Parliament and not by state legislatures so that uniformity throughout the country is maintained (Article 35)
 DEFINITION OF STATE The term ‘State’ has been used in different provisions concerning the fundamental rights
" Hence, Article 12 has defined the term for the purposes of Part III"
 It is the actions of these agencies that can be challenged in the courts as violating the Fundamental Rights
" According to the Supreme Court, even a private body or an agency working as an instrument of the State falls within the meaning of the ‘State’ under Article 1 LAWS INCONSISTENT WITH FUNDAMENTAL RIGHTS Article 13 declares that all laws that are inconsistent with or in derogation of any of the fundamental rights shall be void"
" In other words, it expressively provides for the doctrine of judicial review"
 This power has been conferred on the Supreme Court (Article 32) and the high courts (Article 226) that can declare a law unconstitutional and invalid on the ground of contravention of any of the Fundamental Rights
" The term ‘law’ in Article 13 has been given a wide connotation so as to include the following: (a) Permanent laws enacted by the Parliament or the state legislatures; (b) Temporary laws like ordinances issued by the president or the state governors; (c) Statutory instruments in the nature of delegated legislation (executive legislation) like order, bye-law, rule, regulation or notification; and (d) Non-legislative sources of law, that is, custom or usage having the force of law"
" Thus, not only a legislation but any of the above can be challenged in the courts as violating a Fundamental Right and hence, can be declared as void"
" Further, Article 13 declares that a constitutional amendment is not a law and hence cannot be challenged"
" However, the Supreme Court held in the Kesavananda Bharati case2 (1973) that a Constitutional amendment can be challenged on the ground that it violates a fundamental right that forms a part of the ‘basic structure’ of the Constitution and hence, can be declared as void"
 Table 1 Fundamental Rights at a Glance Category Consists of  Right to equality (Articles 14– 18) (a) Equality before law and equal protection of laws (Article 14)
" (b) Prohibition of discrimination on grounds of religion, race, caste, sex or place of birth (Article 15)"
 (c) Equality of opportunity in matters of public employment (Article 16)
 (d) Abolition of untouchability and prohibition of its practice (Article 17)
 (e) Abolition of titles except military and academic (Article 18)
"  Right to freedom (Articles 19–22) (a) Protection of six rights regarding freedom of: (i) speech and expression, (ii) assembly, (iii) association, (iv) movement, (v) residence, and (vi) profession (Article 19)"
 (b) Protection in respect of conviction for offences (Article 20)
 (c) Protection of life and personal liberty (Article 21)
 (d) Right to elementary education (Article 21A)
 (e) Protection against arrest and detention in certain cases (Article 22)
  Right against exploitation (Articles 23–24) (a) Prohibition of traffic in human beings and forced labour (Article 23)
" (b) Prohibition of employment of children in factories, etc"
"  Right to freedom of religion (Article 25– 28) (a) Freedom of conscience and free profession, practice and propagation of religion (Article 25)"
 (b) Freedom to manage religious affairs (Article 26)
 (c) Freedom from payment of taxes for promotion of any religion (Article 27)
 (d) Freedom from attending religious instruction or worship in certain educational institutions (Article 28)
"  Cultural and educational rights (Articles 29–30) (a) Protection of language, script and culture of minorities (Article 29)"
 (b) Right of minorities to establish and administer educational institutions (Article 30)
"  Right to constitutional remedies (Article 32) Right to move the Supreme Court for the enforcement of fundamental rights including the writs of (i) habeas corpus, (ii) mandamus, (iii)prohibition, (iv) certiorari, and (v) quo war-rento (Article 32)"
" Table 2 Fundamental Rights (FR) of Foreigners FR available only to citizens and not to foreigners FR available to both citizens and foreigners (except enemy aliens)  Prohibition of discrimination on grounds of religion, race, caste, sex or place of birth (Article 15)"
  Equality before law and equal protection of laws (Article 14)
  Equality of opportunity in matters of public employment (Article 16)
  Protection in respect of conviction for offences (Article 20)
"  Protection of six rights regarding freedom of : (i) speech and expression, (ii) assembly, (iii) association, (iv) movement, (v) residence, and (vi) profession (Article 19)"
  Protection of life and personal liberty (Article 21)
"  Protection of language, script and culture of minorities (Article 29)"
  Right to elementary education (Article 21A)
  Right of minorities to establish and administer educational institutions (Article 30)
  Protection against arrest and detention in certain cases (Article 22)
  Prohibition of traffic in human beings and forced labour (Article 23)
  Prohibition of employment of children in factories etc
"  Freedom of conscience and free profession, practice and propagation of religion (Article 25)"
  Freedom to manage religious affairs (Article 26)
  Freedom from payment of taxes for promotion of any religion (Article 27)
Freedom from attending religious instruction or worship in certain educational institutions (Article 28)
 RIGHT TO EQUALITY  Equality before Law and Equal Protection of Laws Article 14 says that the State shall not deny to any person equality before the law or the equal protection of the laws within the territory of India
 This provision confers rights on all persons whether citizens or foreigners
" Moreover, the word ‘person’ includes legal persons, viz, statutory corporations, companies, registered societies or any other type of legal person"
 The concept of ‘equality before law’ is of British origin while the concept of ‘equal protection of laws’ has been taken from the American Constitution
" The second concept, on the other hand, connotes: (a) the equality of treatment under equal circumstances, both in the privileges conferred and liabilities imposed by the laws, (b) the similar application of the same laws to all persons who are similarly situated, and (c) the like should be treated alike without any discrimination"
" Thus, the former is a negative concept while the latter is a positive concept"
" However, both of them aim at establishing equality of legal status, opportunity and justice"
" The Supreme Court held that where equals and unequals are treated differently, Article 14 does not apply"
" While Article 14 forbids class legislation, it permits reasonable classification of persons, objects and transactions by the law"
" Rather, it should be based on an intelligible differential and substantial distinction"
" Rule of Law The concept of ‘equality before law’ is an element of the concept of ‘Rule of Law’, propounded by A"
" His concept has the following three elements or aspects: (i) Absence of arbitrary power, that is, no man can be punished except for a breach of law"
" (ii) Equality before the law, that is, equal subjection of all citizens (rich or poor, high or low, official or non-official) to the ordinary law of the land administered by the ordinary law courts (iii) The primacy of the rights of the individual, that is, the constitution is the result of the rights of the individual as defined and enforced by the courts of law rather than the constitution being the source of the individual rights"
 The first and the second elements are applicable to the Indian System and not the third one
" In the Indian System, the constitution is the source of the individual rights"
 The Supreme Court held that the ‘Rule of Law’ as embodied in Article 14 is a ‘basic feature’ of the constitution
 Exceptions to Equality The rule of equality before law is not absolute and there are constitutional and other exceptions to it
"  Article 31-C is an exception to Article 1 It provides that the laws made by the state for implementing the Directive Principles contained in clause (b) or clause (c) of Article 39 cannot be challenged on the ground that they are violative of Article 1 The Supreme Court held that “where Article 31-C comes in, Article 14 goes out”"
"  The foreign sovereigns (rulers), ambassadors and diplomats enjoy immunity from criminal and civil proceedings"
  The UNO and its agencies enjoy the diplomatic immunity
"  Prohibition of Discrimination on Certain Grounds Article 15 provides that the State shall not discriminate against any citizen on grounds only of religion, race, caste, sex or place of birth"
 The two crucial words in this provision are ‘discrimination’ and ‘only’
 The word ‘discrimination’ means ‘to make an adverse distinction with regard to’ or ‘to distinguish unfavourably from others’
 The use of the word ‘only’ connotes that discrimination on other grounds is not prohibited
" The second provision of Article 15 says that no citizen shall be subjected to any disability, liability, restriction or condition on grounds only of religion, race, caste, sex, or place of birth with regard to (a) access to shops, public restaurants, hotels and places of public entertainment; or (b) the use of wells, tanks, bathing ghats, road and places of public resort maintained wholly or partly by State funds or dedicated to the use of general public"
" This provision prohibits discrimination both by the State and private individuals, while the former provision prohibits discrimination only by the State"
 There are three exceptions to this general rule of non-discrimination: (a) The state is permitted to make any special provision for women and children
" For example, reservation of seats for women in local bodies or provision of free education for children"
" (b) The state is permitted to make any special provision for the advancement of any socially and educationally backward classes of citizens or for the scheduled castes and scheduled tribes For example, reservation of seats or fee concessions in public educational institutions"
" (c) The state is empowered to make any special provision for the advancement of any socially and educationally backward classes of citizens or for the scheduled castes or the scheduled tribes regarding their admission to educational institutions including private educational institutions, whether aided or unaided by the state, except the minority educational institutions"
" The last provision was added by the 93rd Amendment Act of 200 In order to give effect to this provision, the Centre enacted the Central Educational Institutions (Reservation in Admission) Act, 2006, providing a quota of 27% for candidates belonging to the Other Backward Classes (OBCs) in all central higher educational institutions including the Indian Institutes of Technology (IITs) and the Indian Institutes of Management (IIMs)"
" In April 2008, the Supreme Court upheld the validity of both, the Amendment Act and the OBC Quota Act"
" But, the Court directed the central government to exclude the ‘creamy layer’ (advanced sections) among the OBCs while implementing the law"
" No citizen can be discriminated against or be ineligible for any employment or office under the State on grounds of only religion, race, caste, sex, descent, place of birth or residence"
 There are three exceptions to this general rule of equality of opportunity in public employment: (a) Parliament can prescribe residence as a condition for certain employment or appointment in a state or union territory or local authority or other authority
" As the Public Employment (Requirement as to Residence) Act of 1957 expired in 1974, there is no such provision for any state except Andhra Pradesh5 and Telangana5a"
 (b) The State can provide for reservation of appointments or posts in favour of any backward class that is not adequately represented in the state services
 (c) A law can provide that the incumbent of an office related to religious or denominational institution or a member of its governing body should belong to the particular religion or denomination
" Under the Protection of Civil Rights Act (1955), the offences committed on the ground of untouchability are punishable either by imprisonment up to six months or by fine upto 500 or both"
 A person convicted of the offence of ‘untouchability’ is disqualified for election to the Parliament or state legislature
" The act declares the following acts as offences: (a) preventing any person from entering any place of public worship or from worshipping therein; (b) justifying untouchability on traditional, religious, philosophical or other grounds; (c) denying access to any shop, hotel or places of public entertainment; (d) insulting a person belonging to scheduled caste on the ground of untouchability; (e) refusing to admit persons in hospitals, educational institutions or hostels established for public benefit; (f) preaching untouchability directly or indirectly; and (g) refusing to sell goods or render services to any person"
 The Supreme Court held that the right under Article 17 is available against private individuals and it is the constitutional obligation of the State to take necessary action to ensure that this right is not violated
 These National Awards were instituted in 195 The Janata Party government headed by Morarji Desai discontinued them in 197 But they were again revived in 1980 by the Indira Gandhi government
 RIGHT TO FREEDOM  Protection of Six Rights Article 19 guarantees to all citizens the six rights
 These are: (i) Right to freedom of speech and expression
 (ii) Right to assemble peaceably and without arms
 (iii) Right to form associations or unions or co-operative societies
10 (iv) Right to move freely throughout the territory of India
 (v) Right to reside and settle in any part of the territory of India
" (vi) Right to practice any profession or to carry on any occupation, trade or business"
" Originally, Article 19 contained seven rights"
" But, the right to acquire, hold and dispose of property was deleted by the 44th Amendment Act of 197 These six rights are protected against only state action and not private individuals"
" Moreover, these rights are available only to the citizens and to shareholders of a company but not to foreigners or legal persons like companies or corporations, etc"
 The State can impose ‘reasonable’ restrictions on the enjoyment of these six rights only on the grounds mentioned in the Article 19 itself and not on any other grounds
" Freedom of Speech and Expression It implies that every citizen has the right to express his views, opinions, belief and convictions freely by word of mouth, writing, printing, picturing or in any other manner"
 The Supreme Court held that the freedom of speech and expression includes the following: (a) Right to propagate one’s views as well as views of others
 (b) Freedom of the press
 (c) Freedom of commercial advertisements
 (d) Right against tapping of telephonic conversation
" (e) Right to telecast, that is, government has no monopoly on electronic media"
 (f) Right against bundh called by a political party or organisation
 (g) Right to know about government activities
 (h) Freedom of silence
 (i) Right against imposition of pre-censorship on a newspaper
 (j) Right to demonstration or picketing but not right to strike
" The State can impose reasonable restrictions on the exercise of the freedom of speech and expression on the grounds of sovereignty and integrity of India, security of the state, friendly relations with foreign states, public order, decency or morality, contempt of court, defamation, and incitement to an offence"
 Freedom of Assembly Every citizen has the right to assemble peaceably and without arms
" It includes the right to hold public meetings, demonstrations and take out processions"
 This freedom can be exercised only on public land and the assembly must be peaceful and unarmed
" This provision does not protect violent, disorderly, riotous assemblies, or one that causes breach of public peace or one that involves arms"
 This right does not include the right to strike
" The State can impose reasonable restrictions on the exercise of right of assembly on two grounds, namely, sovereignty and integrity of India and public order including the maintenance of traffic in the area concerned"
" Under Section 144 of Criminal Procedure Code (1973), a magistrate can restrain an assembly, meeting or procession if there is a risk of obstruction, annoyance or danger to human life, health or safety or a disturbance of the public tranquillity or a riot or any affray"
" Under Section 141 of the Indian Penal Code, as assembly of five or more persons becomes unlawful if the object is (a) to resist the execution of any law or legal process; (b) to forcibly occupy the property of some person; (c) to commit any mischief or criminal trespass; (d) to force some person to do an illegal act; and (e) to threaten the government or its officials on exercising lawful powers"
 Freedom of Association All citizens have the right to form associations or unions or co-operative societies10b
" It includes the right to form political parties, companies, partnership firms, societies, clubs, organisations, trade unions or any body of persons"
 It not only includes the right to start an association or union but also to continue with the association or union as such
" Further, it covers the negative right of not to form or join an association or union"
" Reasonable restrictions can be imposed on the exercise of this right by the State on the grounds of sovereignty and integrity of India, public order and morality"
" Subject to these restrictions, the citizens have complete liberty to form associations or unions for pursuing lawful objectives and purposes"
" However, the right to obtain recognition of the association is not a fundamental right"
 The Supreme Court held that the trade unions have no guaranteed right to effective bargaining or right to strike or right to declare a lock-out
 The right to strike can be controlled by an appropriate industrial law
 Freedom of Movement This freedom entitles every citizen to move freely throughout the territory of the country
 He can move freely from one state to another or from one place to another within a state
 This right underline the idea that India is one unit so far as the citizens are concerned
" Thus, the purpose is to promote national feeling and not parochialism"
" The grounds of imposing reasonable restrictions on this freedom are two, namely, the interests of general public and the protection of interests of any scheduled tribe"
" The entry of outsiders in tribal areas is restricted to protect the distinctive culture, language, customs and manners of scheduled tribes and to safeguard their traditional vocation and properties against exploitation"
 The Supreme Court held that the freedom of movement of prostitutes can be restricted on the ground of public health and in the interest of public morals
 The Bombay High Court validated the restrictions on the movement of persons affected by AIDS
" The freedom of movement has two dimensions, viz, internal (right to move inside the country) and external (right to move out of the country and right to come back to the country)"
 Freedom of Residence Every citizen has the right to reside and settle in any part of the territory of the country
" This right has two parts: (a) the right to reside in any part of the country, which means to stay at any place temporarily, and (b) the right to settle in any part of the country, which means to set up a home or domicile at any place permanently"
 This right is intended to remove internal barriers within the country or between any of its parts
 This promotes nationalism and avoids narrow mindedness
" The State can impose reasonable restrictions on the exercise of this right on two grounds, namely, the interest of general public and the protection of interests of any scheduled tribes"
" The right of outsiders to reside and settle in tribal areas is restricted to protect the distinctive culture, language, customs and manners of scheduled tribes and to safeguard their traditional vocation and properties against exploitation"
" In many parts of the country, the tribals have been permitted to regulate their property rights in accordance with their customary rules and laws"
 The Supreme Court held that certain areas can be banned for certain kinds of persons like prostitutes and habitual offenders
" From the above, it is clear that the right to residence and the right to movement are overlapping to some extent"
" All citizens are given the right to practise any profession or to carry on any occupation, trade or business"
